{
  "memo_id": "mock-eisa-memo-software_developer-paper-02",
  "paper_id": "mock-eisa-software_developer-paper-02",
  "status_disclaimer": "MOCK / PRACTICE ASSESSMENT ONLY. This paper is generated for formative self-assessment and exam-preparation purposes. It is NOT an official QCTO External Integrated Summative Assessment (EISA), is not moderated by MICT SETA, and confers no qualification status or credit.",
  "total_marks": 100,
  "sections": [
    {
      "id": "A",
      "questions": [
        {
          "question_id": "Q-A1",
          "total_marks": 15,
          "model_answer": "See per-part model answers below.",
          "criteria": [
            {
              "description": "See per-part criteria in sub_questions.",
              "marks": 15
            }
          ],
          "accepted_alternatives": [],
          "partial_credit_guidance": "Award marks per part independently. For worked calculations, award method marks even if the final numeric answer is wrong due to a single arithmetic slip, provided the method/order of operations is correct.",
          "sub_questions": [
            {
              "id": "1",
              "total_marks": 3,
              "model_answer": "10110(2) = 1x2^4 + 0x2^3 + 1x2^2 + 1x2^1 + 0x2^0 = 16 + 0 + 4 + 2 + 0 = 22",
              "criteria": [
                {
                  "description": "Correct positional/place-value setup shown",
                  "marks": 1
                },
                {
                  "description": "Correct arithmetic at each place value",
                  "marks": 1
                },
                {
                  "description": "Correct final decimal value",
                  "marks": 1
                }
              ],
              "accepted_alternatives": [
                "Doubling method (start from leftmost bit, double-and-add) reaching the same final value."
              ]
            },
            {
              "id": "2",
              "total_marks": 4,
              "model_answer": "23 % 4 = 3; 3 * 2 = 6; 6 - 5 = 1; 1 + 1 = 2. distance = 2.",
              "criteria": [
                {
                  "description": "Modulus evaluated correctly first (correct precedence)",
                  "marks": 1
                },
                {
                  "description": "Multiplication evaluated before remaining addition/subtraction",
                  "marks": 1
                },
                {
                  "description": "Left-to-right evaluation of remaining +/- operators",
                  "marks": 1
                },
                {
                  "description": "Correct final value stated",
                  "marks": 1
                }
              ],
              "accepted_alternatives": []
            },
            {
              "id": "3",
              "total_marks": 4,
              "model_answer": "speed=50,55: not >60, no print; speed=60: not >60 (boundary), no print; speed=65: >60 -> print 'over limit'. Output: over limit (once).",
              "criteria": [
                {
                  "description": "Correct loop boundary (correct number of iterations)",
                  "marks": 1
                },
                {
                  "description": "Correct condition evaluation at each iteration",
                  "marks": 2
                },
                {
                  "description": "Correct final output sequence/value stated",
                  "marks": 1
                }
              ],
              "accepted_alternatives": [
                "Answer presented as a trace table instead of prose - equally acceptable."
              ]
            },
            {
              "id": "4",
              "total_marks": 4,
              "model_answer": "Python raises this TypeError because `+` between a `str` and a `float` is not defined - Python does not implicitly convert numbers to strings the way some other languages (e.g. JavaScript) do. Fix: `log = \"Trip length: \" + str(12.3) + \" km\"` (or `f\"Trip length: {12.3} km\"`), both of which produce `\"Trip length: 12.3 km\"`.",
              "criteria": [
                {
                  "description": "Correctly explains that Python's `+` operator does not implicitly convert a float to a string (unlike some other languages)",
                  "marks": 2
                },
                {
                  "description": "Provides a corrected line that runs successfully and produces the exact target string",
                  "marks": 2
                }
              ],
              "accepted_alternatives": [
                "str(), f-strings, .format(), or % formatting are all acceptable ways to perform the conversion."
              ],
              "non_awarding_notes": "An answer that only says 'you can't add a string and a number' without naming Python specifically, or that describes JavaScript's automatic string-coercion behaviour instead of Python's, does not earn the explanation marks - the question is now explicitly scoped to Python, where this code genuinely does raise an error."
            }
          ]
        }
      ]
    },
    {
      "id": "B",
      "questions": [
        {
          "question_id": "Q-B1",
          "total_marks": 30,
          "model_answer": "See per-part model answers below.",
          "criteria": [
            {
              "description": "See per-part criteria in sub_questions.",
              "marks": 30
            }
          ],
          "accepted_alternatives": [],
          "partial_credit_guidance": "Working but inelegant code that satisfies the functional requirement of a part earns full marks for that part; deduct only for the specific missing/incorrect behaviour named in that part's criteria, not for style choices (e.g. var vs let, quote style).",
          "sub_questions": [
            {
              "id": "1",
              "total_marks": 6,
              "model_answer": "The task's stated requirement is that at least one interest-area checkbox MUST be checked before the form submits. A <form> containing <input type=\"text\" name=\"fullName\" required>, <input type=\"email\" name=\"email\" required>, and one <input type=\"checkbox\"> per interest area, each paired with a <label>, satisfies the markup part of this. However, HTML5's `required` attribute only ever validates a single element's own value - the browser has no built-in concept of 'at least one checked' across a group of checkboxes, so this specific requirement CANNOT be enforced by HTML5 attributes alone. Enforcing it requires JavaScript (e.g. checking on submit that at least one checkbox in the group is checked) or a workaround such as a single hidden required proxy input tied to the group's state.",
              "criteria": [
                {
                  "description": "Uses a <form> with semantic, appropriately-labelled <input> elements",
                  "marks": 2
                },
                {
                  "description": "Uses type=\"email\" and the required attribute correctly on the name/email fields",
                  "marks": 2
                },
                {
                  "description": "Checkboxes correctly implemented and labelled for the interest areas",
                  "marks": 1
                },
                {
                  "description": "Correctly states that HTML5 cannot natively enforce the stated 'at least one checkbox selected' requirement across a group, and correctly identifies that JavaScript (or an equivalent workaround) is needed to enforce it",
                  "marks": 1
                }
              ],
              "accepted_alternatives": [
                "Use of <label for=...> or wrapping <label> - either is acceptable.",
                "Mentioning aria-required/role=group as an accessibility improvement is a bonus, not a substitute for the correct answer that native HTML5 validation cannot enforce this rule."
              ],
              "non_awarding_notes": "Claiming that HTML5 attributes alone CAN enforce 'at least one checkbox selected' earns 0 for the fourth criterion, regardless of how the checkboxes are marked up."
            },
            {
              "id": "2",
              "total_marks": 6,
              "model_answer": "`.form-field { display: flex; flex-direction: column; }` by default, then `@media (min-width: 768px) { .form-field { flex-direction: row; align-items: center; } }`. Flexbox suits this because it lets the same markup reflow between a stacked and inline layout by changing a single property (flex-direction) rather than rewriting positioning rules.",
              "criteria": [
                {
                  "description": "Correct default (mobile-first) stacked flex layout",
                  "marks": 2
                },
                {
                  "description": "Correct media query breakpoint and row layout for wider screens",
                  "marks": 3
                },
                {
                  "description": "Sensible one-sentence justification for choosing Flexbox",
                  "marks": 1
                }
              ],
              "accepted_alternatives": [
                "Any reasonable breakpoint value (e.g. 700px-800px) with correct reasoning is acceptable; 768px is the suggested convention, not a strict requirement.",
                "CSS Grid used instead of Flexbox, provided the same responsive behaviour is achieved and justified - award full marks for the layout, partial for the Flexbox-specific justification."
              ]
            },
            {
              "id": "3",
              "total_marks": 8,